patches/moe-configs/E=256,N=128,device_name=Intel(R)_Graphics_[0xe223].json
{
  "8": {
    "BLOCK_SIZE_M": 32,
    "BLOCK_SIZE_N": 64,
    "BLOCK_SIZE_K": 64,
    "GROUP_SIZE_M": 8,
    "num_warps": 4,
    "num_stages": 2
  },
  "16": {
    "BLOCK_SIZE_M": 16,
    "BLOCK_SIZE_N": 128,
    "BLOCK_SIZE_K": 64,
    "GROUP_SIZE_M": 16,
    "num_warps": 8,
    "num_stages": 2
  },
  "32": {
    "BLOCK_SIZE_M": 16,
    "BLOCK_SIZE_N": 64,
    "BLOCK_SIZE_K": 64,
    "GROUP_SIZE_M": 8,
    "num_warps": 8,
    "num_stages": 2
  },
  "64": {
    "BLOCK_SIZE_M": 16,
    "BLOCK_SIZE_N": 128,
    "BLOCK_SIZE_K": 64,
    "GROUP_SIZE_M": 16,
    "num_warps": 4,
    "num_stages": 2
  },
  "128": {
    "BLOCK_SIZE_M": 16,
    "BLOCK_SIZE_N": 64,
    "BLOCK_SIZE_K": 64,
    "GROUP_SIZE_M": 16,
    "num_warps": 8,
    "num_stages": 4
  },
  "256": {
    "BLOCK_SIZE_M": 16,
    "BLOCK_SIZE_N": 64,
    "BLOCK_SIZE_K": 64,
    "GROUP_SIZE_M": 16,
    "num_warps": 4,
    "num_stages": 2
  },
  "512": {
    "BLOCK_SIZE_M": 16,
    "BLOCK_SIZE_N": 128,
    "BLOCK_SIZE_K": 64,
    "GROUP_SIZE_M": 8,
    "num_warps": 4,
    "num_stages": 2
  },
  "1024": {
    "BLOCK_SIZE_M": 16,
    "BLOCK_SIZE_N": 128,
    "BLOCK_SIZE_K": 64,
    "GROUP_SIZE_M": 8,
    "num_warps": 4,
    "num_stages": 2
  },
  "2048": {
    "BLOCK_SIZE_M": 32,
    "BLOCK_SIZE_N": 128,
    "BLOCK_SIZE_K": 64,
    "GROUP_SIZE_M": 16,
    "num_warps": 8,
    "num_stages": 4
  }
}